{
  "$schema": "https://json-schema.org/draft/2020-12/schema",
  "$id": "https://roblox-top1.local/schemas/territory.schema.json",
  "type": "object",
  "required": [
    "$schema",
    "schemaVersion",
    "territoryId",
    "status",
    "vision",
    "pillars",
    "antiPillars",
    "paletteBias",
    "blockoutPalette",
    "shapeLanguage",
    "materialBias",
    "surfaceAssignments",
    "assetRecipes",
    "referenceBoardId",
    "comparisonBudget",
    "automation"
  ],
  "properties": {
    "$schema": {
      "const": "https://roblox-top1.local/schemas/territory.schema.json"
    },
    "schemaVersion": {
      "type": "string",
      "pattern": "^[0-9]+\\.[0-9]+\\.[0-9]+$"
    },
    "territoryId": {
      "enum": [
        "industrial-toy-defense",
        "salvaged-frontier",
        "clean-tactical-diorama"
      ]
    },
    "status": {
      "const": "CANDIDATE"
    },
    "vision": {
      "type": "string",
      "minLength": 40
    },
    "pillars": {
      "type": "array",
      "minItems": 3,
      "maxItems": 5,
      "items": {
        "type": "string"
      },
      "uniqueItems": true
    },
    "antiPillars": {
      "type": "array",
      "minItems": 3,
      "maxItems": 5,
      "items": {
        "type": "string"
      },
      "uniqueItems": true
    },
    "paletteBias": {
      "type": "object",
      "properties": {
        "accentSaturation": {
          "type": "number",
          "minimum": 0
        },
        "neutralTemperature": {
          "type": "string",
          "minLength": 1
        },
        "warningCoverageMax": {
          "type": "number",
          "minimum": 0
        }
      },
      "unevaluatedProperties": false,
      "required": [
        "accentSaturation",
        "neutralTemperature",
        "warningCoverageMax"
      ]
    },
    "shapeLanguage": {
      "type": "object",
      "properties": {
        "angleFamiliesDegrees": {
          "type": "array",
          "items": {
            "type": "number",
            "minimum": 0
          },
          "minItems": 3
        },
        "asymmetry": {
          "type": "object",
          "properties": {
            "max": {
              "type": "number",
              "minimum": 0
            },
            "target": {
              "type": "number",
              "minimum": 0
            }
          },
          "unevaluatedProperties": false,
          "required": [
            "max",
            "target"
          ]
        },
        "primarySecondarySizeRatio": {
          "type": "object",
          "properties": {
            "max": {
              "type": "number",
              "minimum": 0
            },
            "min": {
              "type": "number",
              "minimum": 0
            }
          },
          "unevaluatedProperties": false,
          "required": [
            "max",
            "min"
          ]
        },
        "roundness": {
          "type": "string",
          "minLength": 1
        }
      },
      "unevaluatedProperties": false,
      "required": [
        "angleFamiliesDegrees",
        "asymmetry",
        "primarySecondarySizeRatio",
        "roundness"
      ]
    },
    "materialBias": {
      "type": "array",
      "minItems": 2,
      "items": {
        "type": "string"
      },
      "uniqueItems": true
    },
    "surfaceAssignments": {
      "type": "object",
      "required": [
        "primary",
        "secondary",
        "accent",
        "interaction",
        "threat",
        "warning",
        "critical",
        "rubber",
        "bareMetal"
      ],
      "properties": {
        "primary": {"type": "string", "pattern": "^[a-z_]+$"},
        "secondary": {"type": "string", "pattern": "^[a-z_]+$"},
        "accent": {"type": "string", "pattern": "^[a-z_]+$"},
        "interaction": {"type": "string", "pattern": "^[a-z_]+$"},
        "threat": {"type": "string", "pattern": "^[a-z_]+$"},
        "warning": {"type": "string", "pattern": "^[a-z_]+$"},
        "critical": {"type": "string", "pattern": "^[a-z_]+$"},
        "rubber": {"type": "string", "pattern": "^[a-z_]+$"},
        "bareMetal": {"type": "string", "pattern": "^[a-z_]+$"}
      },
      "unevaluatedProperties": false
    },
    "repairGrammar": {
      "type": "object",
      "properties": {
        "allowedReasons": {
          "type": "array",
          "items": {
            "type": "string",
            "minLength": 1
          },
          "minItems": 4,
          "maxItems": 4
        },
        "maxPatchFamiliesPerAsset": {
          "type": "number",
          "minimum": 0
        },
        "maxUniqueFastenerScale": {
          "type": "number",
          "minimum": 0
        }
      },
      "unevaluatedProperties": false,
      "required": [
        "allowedReasons",
        "maxPatchFamiliesPerAsset",
        "maxUniqueFastenerScale"
      ]
    },
    "assetRecipes": {
      "type": "object",
      "required": [
        "barricade",
        "objective_core",
        "enemy_standard",
        "floor_module",
        "damage_effect"
      ],
      "properties": {
        "barricade": {
          "type": "object",
          "required": [
            "assetId",
            "primaryPrimitives",
            "secondaryPrimitives",
            "asymmetryTarget",
            "moduleCountTarget",
            "bevelRatioTarget",
            "stateBreakStrategy",
            "detailBandTargets"
          ],
          "properties": {
            "assetId": {
              "const": "barricade"
            },
            "primaryPrimitives": {
              "type": "array",
              "minItems": 1,
              "items": {
                "type": "string"
              }
            },
            "secondaryPrimitives": {
              "type": "array",
              "minItems": 1,
              "items": {
                "type": "string"
              }
            },
            "asymmetryTarget": {
              "type": "number",
              "minimum": 0,
              "maximum": 1
            },
            "moduleCountTarget": {
              "type": "integer",
              "minimum": 1,
              "maximum": 20
            },
            "bevelRatioTarget": {
              "type": "number",
              "exclusiveMinimum": 0,
              "maximum": 0.1
            },
            "stateBreakStrategy": {
              "type": "string",
              "minLength": 8
            },
            "detailBandTargets": {
              "type": "object",
              "properties": {
                "primary": {
                  "type": "number",
                  "minimum": 0,
                  "maximum": 1
                },
                "secondary": {
                  "type": "number",
                  "minimum": 0,
                  "maximum": 1
                },
                "tertiary": {
                  "type": "number",
                  "minimum": 0,
                  "maximum": 1
                }
              },
              "required": [
                "primary",
                "secondary",
                "tertiary"
              ],
              "unevaluatedProperties": false
            }
          },
          "unevaluatedProperties": false
        },
        "objective_core": {
          "type": "object",
          "required": [
            "assetId",
            "primaryPrimitives",
            "secondaryPrimitives",
            "asymmetryTarget",
            "moduleCountTarget",
            "bevelRatioTarget",
            "stateBreakStrategy",
            "detailBandTargets"
          ],
          "properties": {
            "assetId": {
              "const": "objective_core"
            },
            "primaryPrimitives": {
              "type": "array",
              "minItems": 1,
              "items": {
                "type": "string"
              }
            },
            "secondaryPrimitives": {
              "type": "array",
              "minItems": 1,
              "items": {
                "type": "string"
              }
            },
            "asymmetryTarget": {
              "type": "number",
              "minimum": 0,
              "maximum": 1
            },
            "moduleCountTarget": {
              "type": "integer",
              "minimum": 1,
              "maximum": 20
            },
            "bevelRatioTarget": {
              "type": "number",
              "exclusiveMinimum": 0,
              "maximum": 0.1
            },
            "stateBreakStrategy": {
              "type": "string",
              "minLength": 8
            },
            "detailBandTargets": {
              "type": "object",
              "properties": {
                "primary": {
                  "type": "number",
                  "minimum": 0,
                  "maximum": 1
                },
                "secondary": {
                  "type": "number",
                  "minimum": 0,
                  "maximum": 1
                },
                "tertiary": {
                  "type": "number",
                  "minimum": 0,
                  "maximum": 1
                }
              },
              "required": [
                "primary",
                "secondary",
                "tertiary"
              ],
              "unevaluatedProperties": false
            }
          },
          "unevaluatedProperties": false
        },
        "enemy_standard": {
          "type": "object",
          "required": [
            "assetId",
            "primaryPrimitives",
            "secondaryPrimitives",
            "asymmetryTarget",
            "moduleCountTarget",
            "bevelRatioTarget",
            "stateBreakStrategy",
            "detailBandTargets"
          ],
          "properties": {
            "assetId": {
              "const": "enemy_standard"
            },
            "primaryPrimitives": {
              "type": "array",
              "minItems": 1,
              "items": {
                "type": "string"
              }
            },
            "secondaryPrimitives": {
              "type": "array",
              "minItems": 1,
              "items": {
                "type": "string"
              }
            },
            "asymmetryTarget": {
              "type": "number",
              "minimum": 0,
              "maximum": 1
            },
            "moduleCountTarget": {
              "type": "integer",
              "minimum": 1,
              "maximum": 20
            },
            "bevelRatioTarget": {
              "type": "number",
              "exclusiveMinimum": 0,
              "maximum": 0.1
            },
            "stateBreakStrategy": {
              "type": "string",
              "minLength": 8
            },
            "detailBandTargets": {
              "type": "object",
              "properties": {
                "primary": {
                  "type": "number",
                  "minimum": 0,
                  "maximum": 1
                },
                "secondary": {
                  "type": "number",
                  "minimum": 0,
                  "maximum": 1
                },
                "tertiary": {
                  "type": "number",
                  "minimum": 0,
                  "maximum": 1
                }
              },
              "required": [
                "primary",
                "secondary",
                "tertiary"
              ],
              "unevaluatedProperties": false
            }
          },
          "unevaluatedProperties": false
        },
        "floor_module": {
          "type": "object",
          "required": [
            "assetId",
            "primaryPrimitives",
            "secondaryPrimitives",
            "asymmetryTarget",
            "moduleCountTarget",
            "bevelRatioTarget",
            "stateBreakStrategy",
            "detailBandTargets"
          ],
          "properties": {
            "assetId": {
              "const": "floor_module"
            },
            "primaryPrimitives": {
              "type": "array",
              "minItems": 1,
              "items": {
                "type": "string"
              }
            },
            "secondaryPrimitives": {
              "type": "array",
              "minItems": 1,
              "items": {
                "type": "string"
              }
            },
            "asymmetryTarget": {
              "type": "number",
              "minimum": 0,
              "maximum": 1
            },
            "moduleCountTarget": {
              "type": "integer",
              "minimum": 1,
              "maximum": 20
            },
            "bevelRatioTarget": {
              "type": "number",
              "exclusiveMinimum": 0,
              "maximum": 0.1
            },
            "stateBreakStrategy": {
              "type": "string",
              "minLength": 8
            },
            "detailBandTargets": {
              "type": "object",
              "properties": {
                "primary": {
                  "type": "number",
                  "minimum": 0,
                  "maximum": 1
                },
                "secondary": {
                  "type": "number",
                  "minimum": 0,
                  "maximum": 1
                },
                "tertiary": {
                  "type": "number",
                  "minimum": 0,
                  "maximum": 1
                }
              },
              "required": [
                "primary",
                "secondary",
                "tertiary"
              ],
              "unevaluatedProperties": false
            }
          },
          "unevaluatedProperties": false
        },
        "damage_effect": {
          "type": "object",
          "required": [
            "assetId",
            "primaryPrimitives",
            "secondaryPrimitives",
            "asymmetryTarget",
            "moduleCountTarget",
            "bevelRatioTarget",
            "stateBreakStrategy",
            "detailBandTargets"
          ],
          "properties": {
            "assetId": {
              "const": "damage_effect"
            },
            "primaryPrimitives": {
              "type": "array",
              "minItems": 1,
              "items": {
                "type": "string"
              }
            },
            "secondaryPrimitives": {
              "type": "array",
              "minItems": 1,
              "items": {
                "type": "string"
              }
            },
            "asymmetryTarget": {
              "type": "number",
              "minimum": 0,
              "maximum": 1
            },
            "moduleCountTarget": {
              "type": "integer",
              "minimum": 1,
              "maximum": 20
            },
            "bevelRatioTarget": {
              "type": "number",
              "exclusiveMinimum": 0,
              "maximum": 0.1
            },
            "stateBreakStrategy": {
              "type": "string",
              "minLength": 8
            },
            "detailBandTargets": {
              "type": "object",
              "properties": {
                "primary": {
                  "type": "number",
                  "minimum": 0,
                  "maximum": 1
                },
                "secondary": {
                  "type": "number",
                  "minimum": 0,
                  "maximum": 1
                },
                "tertiary": {
                  "type": "number",
                  "minimum": 0,
                  "maximum": 1
                }
              },
              "required": [
                "primary",
                "secondary",
                "tertiary"
              ],
              "unevaluatedProperties": false
            }
          },
          "unevaluatedProperties": false
        }
      },
      "unevaluatedProperties": false
    },
    "referenceBoardId": {
      "type": "string",
      "minLength": 8
    },
    "comparisonBudget": {
      "type": "object",
      "properties": {
        "revisionRounds": {
          "const": 2
        },
        "artistHoursCap": {
          "type": "number",
          "exclusiveMinimum": 0
        },
        "triangleBudgetsRef": {
          "type": "string"
        }
      },
      "required": [
        "revisionRounds",
        "artistHoursCap",
        "triangleBudgetsRef"
      ],
      "unevaluatedProperties": false
    },
    "automation": {
      "type": "object",
      "properties": {
        "deterministicSeed": {
          "type": "integer",
          "minimum": 1
        },
        "generatorVersion": {
          "type": "string",
          "pattern": "^[0-9]+\\.[0-9]+\\.[0-9]+$"
        }
      },
      "required": [
        "deterministicSeed",
        "generatorVersion"
      ],
      "unevaluatedProperties": false
    },
    "blockoutPalette": {
      "type": "object",
      "required": [
        "primary",
        "secondary",
        "accent",
        "interaction",
        "threat",
        "warning",
        "critical",
        "rubber",
        "bareMetal"
      ],
      "properties": {
        "primary": {
          "type": "string",
          "pattern": "^#[0-9A-Fa-f]{6}$"
        },
        "secondary": {
          "type": "string",
          "pattern": "^#[0-9A-Fa-f]{6}$"
        },
        "accent": {
          "type": "string",
          "pattern": "^#[0-9A-Fa-f]{6}$"
        },
        "interaction": {
          "type": "string",
          "pattern": "^#[0-9A-Fa-f]{6}$"
        },
        "threat": {
          "type": "string",
          "pattern": "^#[0-9A-Fa-f]{6}$"
        },
        "warning": {
          "type": "string",
          "pattern": "^#[0-9A-Fa-f]{6}$"
        },
        "critical": {
          "type": "string",
          "pattern": "^#[0-9A-Fa-f]{6}$"
        },
        "rubber": {
          "type": "string",
          "pattern": "^#[0-9A-Fa-f]{6}$"
        },
        "bareMetal": {
          "type": "string",
          "pattern": "^#[0-9A-Fa-f]{6}$"
        }
      },
      "unevaluatedProperties": false
    }
  },
  "unevaluatedProperties": false
}
